{"$schema":"https://json-schema.org/draft/2020-12/schema","additionalProperties":false,"properties":{"counts":{"additionalProperties":{"minimum":0,"type":"number"},"type":"object"},"criteria":{"additionalProperties":{"const":"PASS"},"type":"object"},"limitations":{"items":{"type":"string"},"type":"array"},"raw_sha256":{"pattern":"^[0-9a-f]{64}$","type":"string"},"schema":{"const":"graphx.fhss.phase5-qualification-report.v1"},"statement":{"type":"string"},"verdicts":{"additionalProperties":{"type":"string"},"type":"object"}},"required":["schema","raw_sha256","criteria","verdicts","counts","limitations","statement"],"title":"FHSS Phase 5 aggregate qualification report","type":"object"}
